{
  "$schema": "https://wcarmon.com/schemas/codegen/request.schema.json",
  "allowOverride": true,
  "entityConfigDirs": [
    "file:///home/wcarmon/git-repos/codegen/samples/entities"
  ],
  "extraJVMImports": [
    "com.wcarmon.chrono.model00.*",
    "com.wcarmon.ub.model.UBUuid",
    "io.opentracing.Span",
    "io.opentracing.Tracer",
    "java.util.function.Function",
    "java.util.function.Supplier",
    "java.util.List",
    "java.util.Objects",
    "java.util.Set"
  ],
  "jvmContextClass": "com.wcarmon.chrono.context.ChronoContext",
  "outputDirectory": "file:///home/wcarmon/git-repos/modern-jvm/sandbox/src/gen/java/com/wcarmon/chrono/dao00",
  "outputFilenameTemplate": "%sTracedDAO.java",
  "outputMode": "multiple",
  "package": "com.wcarmon.chrono.dao00",
  "templateURI": "classpath:/templates/dao/traced-delegate.java8.ftl"
}
