{
  "$schema": "https://wcarmon.com/schemas/codegen/request.schema.json",
  "allowOverride": true,
  "entityConfigDirs": [
    "file:///home/wcarmon/git-repos/codegen/samples/entities"
  ],
  "extraJVMImports": [
    "com.fasterxml.jackson.core.type.TypeReference",
    "com.fasterxml.jackson.databind.ObjectMapper",
    "com.fasterxml.jackson.databind.ObjectWriter",
    "com.wcarmon.chrono.dao30.*",
    "com.wcarmon.chrono.model30.*"
  ],
  "outputDirectory": "file:///home/wcarmon/git-repos/modern-jvm/sandbox/src/gen/java/com/wcarmon/chrono/mapper30",
  "outputFilenameTemplate": "SQLDelightMappers.kt",
  "outputMode": "single",
  "package": "com.wcarmon.chrono.mapper30",
  "templateURI": "classpath:/templates/sqldelight/mappers.kotlin.ftl"
}
