{
  "$schema": "https://wcarmon.com/schemas/codegen/request.schema.json",
  "allowOverride": true,
  "entityConfigDirs": [
    "file:///home/wcarmon/git-repos/codegen/samples/entities"
  ],
  "outputDirectory": "file:///home/wcarmon/git-repos/modern-jvm/sandbox/src/gen/java/com/wcarmon/chrono/sql00",
  "outputFilenameTemplate": "SQLQueries.java",
  "outputMode": "single",
  "package": "com.wcarmon.chrono.sql00",
  "templateURI": "classpath:/templates/jdbc-template/sql.queries.java8.ftl"
}
