{
  "$schema": "https://wcarmon.com/schemas/codegen/request.schema.json",
  "allowOverride": true,
  "entityConfigDirs": [
    "file:///home/wcarmon/git-repos/codegen/samples/entities"
  ],
  "extraJVMImports": [
    "com.wcarmon.chrono.dao00.*",
    "com.wcarmon.chrono.model00.*",
    "io.opentracing.Tracer",
    "javax.servlet.http.HttpServletRequest",
    "org.springframework.web.bind.annotation.DeleteMapping",
    "org.springframework.web.bind.annotation.GetMapping",
    "org.springframework.web.bind.annotation.PatchMapping",
    "org.springframework.web.bind.annotation.PathVariable",
    "org.springframework.web.bind.annotation.PostMapping",
    "org.springframework.web.bind.annotation.PutMapping",
    "org.springframework.web.bind.annotation.RequestBody",
    "org.springframework.web.bind.annotation.RequestHeader",
    "org.springframework.web.bind.annotation.RequestMapping",
    "org.springframework.web.bind.annotation.RestController"
  ],
  "jvmContextClass": "com.wcarmon.chrono.context.ChronoContext",
  "outputDirectory": "file:///home/wcarmon/git-repos/modern-jvm/sandbox/src/gen/java/com/wcarmon/chrono/web/html00",
  "outputFilenameTemplate": "%sHTMLController.kt",
  "outputMode": "multiple",
  "package": "com.wcarmon.chrono.web.html00",
  "templateURI": "classpath:/templates/spring-web/html-controller.java8.ftl"
}
