{
  "$schema": "https://wcarmon.com/schemas/codegen/request.schema.json",
  "allowOverride": true,
  "entityConfigDirs": [
    "file:///home/wcarmon/git-repos/codegen/samples/entities"
  ],
  "extraJVMImports": [
    "com.wcarmon.chrono.dao31.*",
    "com.wcarmon.chrono.model30.*",
    "com.wcarmon.tracing.SpanElement",
    "com.wcarmon.ub.model.UBUuid",
    "io.opentracing.Span",
    "io.opentracing.Tracer",
    "java.util.function.Function",
    "kotlin.coroutines.coroutineContext",
    "kotlinx.coroutines.withContext"
  ],
  "outputDirectory": "file:///home/wcarmon/git-repos/modern-jvm/sandbox/src/gen/kotlin/com/wcarmon/chrono/dao31",
  "outputFilenameTemplate": "%sTracedDAO.kt",
  "outputMode": "multiple",
  "package": "com.wcarmon.chrono.dao31",
  "templateURI": "classpath:/templates/dao/traced-delegate.coroutine.kotlin.ftl"
}
