{
  "$schema": "https://wcarmon.com/schemas/codegen/request.schema.json",
  "allowOverride": true,
  "entityConfigDirs": [
    "file:///home/wcarmon/git-repos/codegen/samples/entities"
  ],
  "outputDirectory": "file:///home/wcarmon/git-repos/modern-jvm/sandbox/src/main/sqldelight/com/wcarmon/chrono/dao30",
  "outputFilenameTemplate": "%s.sq",
  "outputMode": "multiple",
  "package": "com.wcarmon.chrono.dao30",
  "templateURI": "classpath:/templates/sqldelight/sq.ftl"
}
