{
  "$schema": "https://wcarmon.com/schemas/codegen/request.schema.json",
  "allowOverride": true,
  "entityConfigDirs": [
    "file:///home/wcarmon/git-repos/codegen/samples/entities"
  ],
  "outputDirectory": "file:///home/wcarmon/git-repos/modern-jvm/sandbox/src/gen/proto",
  "outputFilenameTemplate": "entities.proto",
  "outputMode": "single",
  "package": "com.wcarmon.chrono.grpc",
  "templateURI": "classpath:/templates/protobuf/entities.ftl"
}
