{
  "$schema": "https://wcarmon.com/schemas/codegen/request.schema.json",
  "allowOverride": true,
  "entityConfigDirs": [
    "file:///home/wcarmon/git-repos/codegen/samples/entities"
  ],
  "extraJVMImports": [
    "com.wcarmon.chrono.dao30.*",
    "io.opentracing.Tracer",
    "java.util.function.Function",
    "org.springframework.context.annotation.Bean",
    "org.springframework.context.annotation.Configuration"
  ],
  "outputDirectory": "file:///home/wcarmon/git-repos/modern-jvm/sandbox/src/gen/kotlin/com/wcarmon/chrono/config30",
  "outputFilenameTemplate": "TracedDAOBeans.kt",
  "outputMode": "single",
  "package": "com.wcarmon.chrono.config30",
  "templateURI": "classpath:/templates/spring/configuration.traced-dao.kotlin.ftl"
}
