{
  "$schema": "https://wcarmon.com/schemas/codegen/request.schema.json",
  "allowOverride": true,
  "entityConfigDirs": [
    "file:///home/wcarmon/git-repos/codegen/samples/entities"
  ],
  "extraJVMImports": [
    "com.wcarmon.chrono.grpc.*",
    "com.wcarmon.chrono.model00.*",
    "java.util.Collection",
    "java.util.Collections",
    "java.util.List",
    "java.util.Objects",
    "java.util.Set",
    "java.util.stream.Collectors"
  ],
  "outputDirectory": "file:///home/wcarmon/git-repos/modern-jvm/sandbox/src/gen/java/com/wcarmon/chrono/proto00",
  "outputFilenameTemplate": "ProtoMappers.java",
  "outputMode": "single",
  "package": "com.wcarmon.chrono.proto00",
  "templateURI": "classpath:/templates/proto/proto-mapper.java8.ftl"
}
