{
  "$schema": "https://wcarmon.com/schemas/codegen/request.schema.json",
  "allowOverride": true,
  "entityConfigDirs": [
    "file:///home/wcarmon/git-repos/codegen/samples/entities"
  ],
  "extraJVMImports": [
    "com.fasterxml.jackson.databind.ObjectWriter",
    "com.wcarmon.chrono.dao00.*",
    "com.wcarmon.chrono.model00.*",
    "com.wcarmon.chrono.sql00.SQLQueries",
    "java.sql.Types",
    "java.util.Collection",
    "java.util.Collections",
    "java.util.List",
    "java.util.Map",
    "java.util.Objects",
    "java.util.Set",
    "org.springframework.jdbc.core.JdbcTemplate",
    "org.springframework.jdbc.core.RowMapper"
  ],
  "jvmContextClass": "com.wcarmon.chrono.context.ChronoContext",
  "outputDirectory": "file:///home/wcarmon/git-repos/modern-jvm/sandbox/src/gen/java/com/wcarmon/chrono/dao00",
  "outputFilenameTemplate": "%sDAOImpl.java",
  "outputMode": "multiple",
  "package": "com.wcarmon.chrono.dao00",
  "templateURI": "classpath:/templates/jdbc-template/dao-impl.java8.ftl"
}
