{
  "$schema": "https://wcarmon.com/schemas/codegen/request.schema.json",
  "allowOverride": true,
  "entityConfigDirs": [
    "file:///home/wcarmon/git-repos/codegen/samples/entities"
  ],
  "extraJVMImports": [
    "com.fasterxml.jackson.annotation.JsonPropertyOrder",
    "com.fasterxml.jackson.databind.annotation.JsonDeserialize",
    "com.fasterxml.jackson.databind.annotation.JsonPOJOBuilder"
  ],
  "outputDirectory": "file:///home/wcarmon/git-repos/modern-jvm/sandbox/src/gen/java/com/wcarmon/chrono/model30",
  "outputFilenameTemplate": "%s.kt",
  "outputMode": "multiple",
  "package": "com.wcarmon.chrono.model30",
  "templateURI": "classpath:/templates/pojo/data-class.kotlin.ftl"
}
