{
  "$schema": "https://wcarmon.com/schemas/codegen/request.schema.json",
  "allowOverride": true,
  "entityConfigDirs": [
    "file:///home/wcarmon/git-repos/codegen/samples/entities"
  ],
  "extraJVMImports": [
    "com.wcarmon.chrono.model01.*",
    "java.util.Collection",
    "java.util.List",
    "java.util.Map",
    "java.util.Set"
  ],
  "jvmContextClass": "com.wcarmon.chrono.context.ChronoContext",
  "outputDirectory": "file:///home/wcarmon/git-repos/modern-jvm/sandbox/src/gen/java/com/wcarmon/chrono/dao01",
  "outputFilenameTemplate": "%sDAO.java",
  "outputMode": "multiple",
  "package": "com.wcarmon.chrono.dao01",
  "templateURI": "classpath:/templates/dao/interface.java8.ftl"
}
