{
  "$schema": "https://wcarmon.com/schemas/codegen/request.schema.json",
  "allowOverride": true,
  "entityConfigDirs": [
    "file:///home/wcarmon/git-repos/codegen/samples/entities"
  ],
  "extraJVMImports": [
    "com.fasterxml.jackson.core.type.TypeReference",
    "com.fasterxml.jackson.databind.ObjectMapper"
  ],
  "outputDirectory": "file:///home/wcarmon/git-repos/modern-jvm/sandbox/src/gen/java/com/wcarmon/chrono/model30",
  "outputFilenameTemplate": "TypeReferences.kt",
  "outputMode": "single",
  "package": "com.wcarmon.chrono.model30",
  "templateURI": "classpath:/templates/pojo/type-references.kotlin.ftl"
}
