{
  "$schema": "https://wcarmon.com/schemas/codegen/request.schema.json",
  "allowOverride": true,
  "entityConfigDirs": [
    "file:///home/wcarmon/git-repos/codegen/samples/entities"
  ],
  "extraJVMImports": [
    "com.fasterxml.jackson.databind.ObjectMapper",
    "com.wcarmon.chrono.model30.*",
    "com.wcarmon.chrono.rowmappers30.*",
    "org.springframework.context.annotation.Bean",
    "org.springframework.context.annotation.Configuration",
    "org.springframework.jdbc.core.RowMapper"
  ],
  "outputDirectory": "file:///home/wcarmon/git-repos/modern-jvm/sandbox/src/gen/kotlin/com/wcarmon/chrono/config30",
  "outputFilenameTemplate": "RowMapperBeans.kt",
  "outputMode": "single",
  "package": "com.wcarmon.chrono.config30",
  "templateURI": "classpath:/templates/spring/configuration.row-mapper.kotlin.ftl"
}
