{
  "$schema": "https://wcarmon.com/schemas/codegen/request.schema.json",
  "allowOverride": true,
  "entityConfigDirs": [
    "file:///home/wcarmon/git-repos/codegen/samples/entities"
  ],
  "extraJVMImports": [
    "com.wcarmon.chrono.model30.*",
    "com.wcarmon.ub.model.UBUuid"
  ],
  "outputDirectory": "file:///home/wcarmon/git-repos/modern-jvm/sandbox/src/gen/kotlin/com/wcarmon/chrono/dao31",
  "outputFilenameTemplate": "%sDAO.kt",
  "outputMode": "multiple",
  "package": "com.wcarmon.chrono.dao31",
  "templateURI": "classpath:/templates/dao/interface.coroutine.kotlin.ftl"
}
