{
  "$schema": "https://wcarmon.com/schemas/codegen/request.schema.json",
  "allowOverride": true,
  "entityConfigDirs": [
    "file:///home/wcarmon/git-repos/codegen/samples/entities"
  ],
  "extraJVMImports": [
    "com.wcarmon.chrono.grpc.*",
    "com.wcarmon.chrono.model30.*",
    "com.wcarmon.ub.model.UBUuid"
  ],
  "outputDirectory": "file:///home/wcarmon/git-repos/modern-jvm/sandbox/src/gen/kotlin/com/wcarmon/chrono/protobuf30",
  "outputFilenameTemplate": "ProtobufMappers.kt",
  "outputMode": "single",
  "package": "com.wcarmon.chrono.protobuf30",
  "templateURI": "classpath:/templates/protobuf/proto-mapper.kotlin.ftl"
}
