{
  "$schema": "https://wcarmon.com/schemas/codegen/request.schema.json",
  "allowOverride": true,
  "entityConfigDirs": [
    "file:///home/wcarmon/git-repos/codegen/samples/entities"
  ],
  "extraJVMImports": [
    "com.wcarmon.chrono.dao30.*",
    "com.wcarmon.chrono.model30.*",
    "com.wcarmon.chrono.sql30.*",
    "io.opentracing.Span",
    "io.opentracing.Tracer",
    "java.util.function.Function"
  ],
  "jvmContextClass": "com.wcarmon.chrono.context.ChronoContext",
  "outputDirectory": "file:///home/wcarmon/git-repos/modern-jvm/sandbox/src/gen/java/com/wcarmon/chrono/dao30",
  "outputFilenameTemplate": "%sTracedDAO.kt",
  "outputMode": "multiple",
  "package": "com.wcarmon.chrono.dao30",
  "templateURI": "classpath:/templates/dao/traced-delegate.kotlin.ftl"
}
