{
  "$schema": "https://wcarmon.com/schemas/codegen/request.schema.json",
  "allowOverride": true,
  "entityConfigDirs": [
    "file:///home/wcarmon/git-repos/codegen/samples/entities"
  ],
  "extraJVMImports": [
    "com.wcarmon.chrono.model30.*"
  ],
  "jvmContextClass": "com.wcarmon.chrono.context.ChronoContext",
  "outputDirectory": "file:///home/wcarmon/git-repos/modern-jvm/sandbox/src/gen/java/com/wcarmon/chrono/dao30",
  "outputFilenameTemplate": "%sDAO.kt",
  "outputMode": "multiple",
  "package": "com.wcarmon.chrono.dao30",
  "templateURI": "classpath:/templates/dao/interface.kotlin.ftl"
}
